[
  {
    "id": "y2-l35-r001",
    "schoolYear": 2,
    "book": "初級 II",
    "lesson": 35,
    "title": "条件形",
    "type": "reference",
    "source": {
      "type": "school_pdf",
      "filename": "g_1_35.pdf"
    },
    "sections": [
      {
        "title": "動詞",
        "table": [
          [
            "グループ",
            "",
            "条件形",
            ""
          ],
          [
            "",
            "肯定",
            "肯定",
            "否定"
          ],
          [
            "I",
            "行きます",
            "行けば",
            "行かなければ"
          ],
          [
            "",
            "急ぎます",
            "急げば",
            "急がなければ"
          ],
          [
            "",
            "出します",
            "出せば",
            "出さなければ"
          ],
          [
            "",
            "待ちます",
            "待てば",
            "待たなければ"
          ],
          [
            "",
            "死にます",
            "死ねば",
            "死ななければ"
          ],
          [
            "",
            "呼びます",
            "呼べば",
            "呼ばなければ"
          ],
          [
            "",
            "飲みます",
            "飲めば",
            "飲まなければ"
          ],
          [
            "",
            "帰ります",
            "帰れば",
            "帰らなければ"
          ],
          [
            "",
            "買います",
            "買えば",
            "買わなければ"
          ],
          [
            "II",
            "食べます",
            "食べれば",
            "食べなければ"
          ],
          [
            "",
            "寝ます",
            "寝れば",
            "寝なければ"
          ],
          [
            "",
            "起きます",
            "起きれば",
            "起きなければ"
          ],
          [
            "",
            "見ます",
            "見れば",
            "見なければ"
          ],
          [
            "III",
            "来(き)ます",
            "来(く)れば",
            "来(こ)なければ"
          ],
          [
            "",
            "します",
            "すれば",
            "しなければ"
          ]
        ]
      },
      {
        "title": "い形容詞",
        "table": [
          [
            "",
            "条件形"
          ],
          [
            "い形",
            "安い",
            "安ければ"
          ],
          [
            "",
            "正しい",
            "正しければ"
          ],
          [
            "",
            "食べたい",
            "食べたければ"
          ],
          [
            "",
            "欲しい",
            "欲しければ"
          ]
        ]
      },
      {
        "title": "な形容詞/名詞",
        "table": [
          [
            "",
            "条件形"
          ],
          [
            "な形",
            "きれい",
            "きれいなら"
          ],
          [
            "",
            "簡単",
            "簡単なら"
          ],
          [
            "Ｎ",
            "雨",
            "雨なら"
          ],
          [
            "",
            "病気",
            "病気なら"
          ]
        ]
      }
    ]
  }
]
