[
  {
    "id": "y1-l11-r001",
    "schoolYear": 1,
    "book": "初級 I",
    "lesson": 11,
    "sourceOrder": 1,
    "title": "助数詞表",
    "type": "reference",
    "table": [
      {
        "counter": "～つ",
        "question": "いくつ",
        "usage": "計算一般的小物品",
        "notes": "一件至十件分別是｢ひとつ、ふたつ、みっつ、よっつ、いつつ、むっつ、ななつ、やっつ、ここのつ、とお｣。十一以上直接用數字來數。"
      },
      {
        "counter": "～人",
        "question": "何人／なんにん",
        "usage": "計算人數",
        "notes": "一個人是｢ひとり｣；兩個人是｢ふたり｣；四個人唸｢よにん｣。"
      },
      {
        "counter": "～台",
        "question": "何台／なんだい",
        "usage": "計算機械／電器／交通工具"
      },
      {
        "counter": "～枚",
        "question": "何枚／なんまい",
        "usage": "計算薄或扁平的物品"
      },
      {
        "counter": "～回",
        "question": "何回／なんかい",
        "usage": "計算次數",
        "notes": "１、6、8、10次分別唸「いっかい、ろっかい、はっかい、じゅっかい」。"
      },
      {
        "counter": "～分",
        "question": "何分／なんぷん",
        "usage": "分鐘",
        "notes": "1、3、4、6、8、10分鐘分別唸「いっぷん、さんぷん、よんぷん、ろっぷん、はっぷん、じゅっぷん」；2、5、7、9分鐘分別唸「にふん、ごふん、ななふん／しちふん、きゅうふん」。"
      },
      {
        "counter": "～時間",
        "question": "何時間／なんじかん",
        "usage": "小時",
        "notes": "四小時唸「よじかん」。"
      },
      {
        "counter": "～日",
        "question": "何日／なんにち",
        "usage": "日數",
        "notes": "一天是｢いちにち｣；一號是｢ついたち｣。"
      },
      {
        "counter": "～週間",
        "question": "何週間／なんしゅうかん",
        "usage": "星期",
        "notes": "一星期唸「いっしゅうかん」。"
      },
      {
        "counter": "～か月",
        "question": "何か月／なんかげつ",
        "usage": "月數",
        "notes": "六個月(｢6か月｣)也可説成半年；半年唸｢はんとし｣。"
      },
      {
        "counter": "～年",
        "question": "何年／なんねん",
        "usage": "年數",
        "notes": "四年唸｢よねん｣。"
      }
    ],
    "source": {
      "type": "school_pdf",
      "filename": "g_1_11.pdf"
    }
  }
]
