[
  {
    "id": "y2-l37-r001",
    "schoolYear": 2,
    "book": "初級 II",
    "lesson": 37,
    "title": "受身動詞",
    "type": "reference",
    "table": [
      [
        "グループ",
        "受身形"
      ],
      [
        "Iグループ",
        "－iます → －a＋れます"
      ],
      [
        "IIグループ",
        "ます形＋られます"
      ],
      [
        "IIIグループ",
        "来ます→来られます／します→されます"
      ]
    ],
    "source": {
      "type": "school_pdf",
      "filename": "g_1_37.pdf"
    }
  }
]

