[
  {
    "id": "y2-l33-r001",
    "schoolYear": 2,
    "book": "初級 II",
    "lesson": 33,
    "title": "命令形・禁止形",
    "type": "reference",
    "table": [
      [
        "グループ",
        "",
        "命令形",
        "禁止形"
      ],
      [
        "I",
        "行きます",
        "行け",
        "行くな"
      ],
      [
        "",
        "急ぎます",
        "急げ",
        "急ぐな"
      ],
      [
        "",
        "出します",
        "出せ",
        "出すな"
      ],
      [
        "",
        "待ちます",
        "待て",
        "待つな"
      ],
      [
        "",
        "死にます",
        "死ね",
        "死ぬな"
      ],
      [
        "",
        "呼びます",
        "呼べ",
        "呼ぶな"
      ],
      [
        "",
        "飲みます",
        "飲め",
        "飲むな"
      ],
      [
        "",
        "走ります",
        "走れ",
        "走るな"
      ],
      [
        "",
        "言います",
        "言え",
        "言うな"
      ],
      [
        "II",
        "食べます",
        "食べろ",
        "食べるな"
      ],
      [
        "",
        "寝ます",
        "寝ろ",
        "寝るな"
      ],
      [
        "",
        "起きます",
        "起きろ",
        "起きるな"
      ],
      [
        "",
        "見ます",
        "見ろ",
        "見るな"
      ],
      [
        "III",
        "来(き)ます",
        "来(こ)い",
        "来(く)るな"
      ],
      [
        "",
        "します",
        "しろ",
        "するな"
      ]
    ],
    "source": {
      "type": "school_pdf",
      "filename": "g_1_33.pdf"
    }
  }
]
